{
  "eventId": "11111111-1111-4111-8111-111111111105",
  "type": "charging.charger.faulted.v1",
  "version": 1,
  "occurredAt": "2025-05-20T18:10:00+08:00",
  "producer": "charging",
  "correlationId": "6f1d2c3b-0000-4000-8000-000000000441",
  "causationId": "cmd-report-fault",
  "payload": { "chargerId": "CP-A12", "connectorId": "CP-A12-2", "faultCode": "GroundFailure", "stillEnergized": false, "occurredAt": "2025-05-20T18:10:00+08:00" }
}
