{
  "eventId": "11111111-1111-4111-8111-111111111102",
  "type": "charging.session.started.v1",
  "version": 1,
  "occurredAt": "2025-05-20T14:04:00+08:00",
  "producer": "charging",
  "correlationId": "6f1d2c3b-0000-4000-8000-000000000441",
  "causationId": "cmd-start-charging",
  "payload": { "sessionId": "S-991", "connectorId": "CP-A12-2", "idTag": "TAG-MONTHLY-77", "startedAt": "2025-05-20T14:04:00+08:00" }
}
