{
  "eventId": "11111111-1111-4111-8111-111111111103",
  "type": "charging.session.completed.v1",
  "version": 1,
  "occurredAt": "2025-05-20T14:31:00+08:00",
  "producer": "charging",
  "correlationId": "6f1d2c3b-0000-4000-8000-000000000441",
  "causationId": "cmd-stop-charging",
  "payload": { "sessionId": "S-991", "connectorId": "CP-A12-2", "energyWh": 12400, "startedAt": "2025-05-20T14:04:00+08:00", "endedAt": "2025-05-20T14:31:00+08:00", "stopReason": "Local" }
}
