{
  "eventId": "11111111-1111-4111-8111-111111111107",
  "type": "ops.work_order.closed.v1",
  "version": 1,
  "occurredAt": "2025-05-20T18:18:00+08:00",
  "producer": "assetops",
  "correlationId": "6f1d2c3b-0000-4000-8000-000000000441",
  "causationId": "cmd-close-wo-2208",
  "payload": { "workOrderId": "WO-2208", "chargerId": "CP-A12", "closedAt": "2025-05-20T18:18:00+08:00", "outcome": "Repaired" }
}
