{
  "eventId": "11111111-1111-4111-8111-111111111101",
  "type": "parking.vehicle_entered.v1",
  "version": 1,
  "occurredAt": "2025-05-20T14:02:00+08:00",
  "producer": "parking",
  "correlationId": "6f1d2c3b-0000-4000-8000-000000000441",
  "causationId": "cmd-vehicle-entered",
  "payload": { "plate": "ABC-1234", "siteId": "SITE-TPE-01", "lane": "IN-1", "occurredAt": "2025-05-20T14:02:00+08:00" }
}
