{
  "eventId": "11111111-1111-4111-8111-111111111106",
  "type": "ops.work_order.opened.v1",
  "version": 1,
  "occurredAt": "2025-05-20T18:10:00+08:00",
  "producer": "assetops",
  "correlationId": "6f1d2c3b-0000-4000-8000-000000000441",
  "causationId": "11111111-1111-4111-8111-111111111105",
  "payload": { "workOrderId": "WO-2208", "chargerId": "CP-A12", "faultCode": "GroundFailure", "openedAt": "2025-05-20T18:10:00+08:00" }
}
