{
  "eventId": "11111111-1111-4111-8111-111111111104",
  "type": "parking.session.closed.v1",
  "version": 1,
  "occurredAt": "2025-05-20T14:33:00+08:00",
  "producer": "parking",
  "correlationId": "6f1d2c3b-0000-4000-8000-000000000441",
  "causationId": "cmd-release",
  "payload": { "parkingSessionId": "P-441", "plate": "ABC-1234", "durationMin": 31, "releaseMode": "Auto" }
}
